1485,Western Tarahumara,tarahumara occidental,tarahumara occidental,Mexico,MEX,,Vulnerable,rarómari raicha,,9196,"Contributor Zarina Estrada, 2000 Census and information provided by INALI",27.3361,-108.5007,"Municipalities of Chínipas, Maguarichi, Rocoroibo, Urique and Uruachi in the state of Chihuahua"
2362,Nunavimmiutitut,nunavimmiutitut,nunavimmiutitut,Canada,CAN,ike,Vulnerable,,,9105,"1996 and 2001 Censuses, Statistics Canada; based on the Department of Canadian Heritage customized census retrievals
UNESCO Atlas 2nd edition (Wurm (2001))
Ethnologue: Languages of the World (Gordon, (2005))
http://www.aboriginalcanada.gc.ca/acp/community/site.nsf/index_en.html
http://en.wikipedia.org/wiki/Portal:Contents",58.1665,-68.3605,Spread over 15 communities in Canada
275,Woods Cree,cree des bois,clisteno del bosque,Canada,CAN,cwd,Vulnerable,Rocky Cree,,9095,"1996 and 2001 Censuses, Statistics Canada; based on the Department of Canadian Heritage customized census retrievals
UNESCO Atlas 2nd edition (Wurm (2001))
Ethnologue: Languages of the World (Gordon, (2005))
http://www.aboriginalcanada.gc.ca/acp/community/site.nsf/index_en.html
http://en.wikipedia.org/wiki/Portal:Contents",55.1711,-102.9061,Spread over 24 communities in Canada
2244,Phula (Viet Nam),phula (Viet Nam),pula (Vietnam),Viet Nam,VNM,"ypa, ypg, ypo, yip, ypn, yhl, ypb, phh, ypm, ypp, yph, ypz",Definitely endangered,,,9046,Bradley 2007,22.7833,105.4666,
1085,Dol-po,dolpo,dolpo,Nepal,NPL,dre,Definitely endangered,D'ölpo; Phoke Dolpa; Dolpa Tibetan; Dolpike,,9000,"Driem, George van. 2001. Languages of the Himalayas. Volumes 1 and 2. Hand-book of Oriental Studies. Section Two: India. Leiden/Boston/Köln: Brill.

Driem, George van. 2007. 'South Asia and the Middle East', pp. 283-347 in Christopher Moseley (ed.) Encyclopedia of the World's Endangered Languages. London/New York: Routledge.

ethnologue.com",29.2193,83.0676,Dolpa district up to Tibetan border
2581,Helong,helong,helong,Indonesia,IDN,heg,Severely endangered,,,9000,"Wurm, Stephen A. 2007. 'Australia and the Pacific', pp. 424-557 in Christopher Moseley (ed.) Encyclopedia of the World's Endangered Languages. London/New York: Routledge.",-10.1905,123.5247,Timor
2337,Lisela,lisela,lisela,Indonesia,IDN,lcl,Vulnerable,,,9000,Grimes 2000,-3.2392,127.0239,Maluku
1219,Motuo Menba,menba de Motuo,monpa de Motuo,"China, India","CHN, IND",tsj,Definitely endangered,Eastern Monpa,,9000,Bradley 2007,28.664,94.0347,"Arunachal Pradesh, West Siang Dt., esp. in and around Menchuka "
1889,Panamahka,panamahka,panamaka,Nicaragua,NIC,sum,Vulnerable,Sumo,,9000,"The Green Book of Language Revitalization in Practice: Toward a Sustainable World De Leanne Hinton, Kenneth Locke Hale Collaborateur Leanne Hinton, Kenneth Locke Hale Publié par Emerald Group Publishing, 2001 ISBN 0123493536",14.2856,-84.5947,Community of Musawas
880,Zuni,zuni,zuñí,United States of America,USA,zun,Vulnerable,,,9000,"Victor Golla, Ives Goddard, Lyle Campbell, Marianne Mithun, and Mauricio Mixco. 2007. North America. Atlas of the World’s Languages (2nd. edition), ed. by R.E. Asher and C.J. Moseley, 7-44.  London: Routledge.",35.082,-108.76,Zuni Pueblo in western New Mexico.
1750,Mopán (Belize),mopán (Belize),mopán (Belize),Belize,BLZ,mop,Severely endangered,,,8980,"The census figures come from internet: Population and Housing Census as recorded by the Centro Centroamericano de Población, Universidad de Costa Rica.  This holds for all the indigenous lgs of Belize",16.2449,-88.8654,"Toledo, Stann Creek, Cayo"
1728,Tulishi,tulishi,tulishi,Sudan,SDN,tey,Severely endangered,"Thulesh, Thulishi, Kuntulishi",,8628,Ethnologue,11.5984,29.0917,
1016,Central Cuicatec,cuicatèque central,cuicateco central,Mexico,MEX,"cux, cut",Vulnerable,dbaku,,8621,Census 2000 and information provided by INALI,17.8,-96.961,"Several municipalities in the state of Oaxaca, among them: Concepción Pápalo, San Juan Bautista Cuicatlán,  San Juan Tepeuxila, San Pedro Sochiapan, Santa María Pápalo, and Santos Reyes Pápalo"
1685,Ts'amay,ts'amakko,tsamai,Ethiopia,ETH,tsb,Definitely endangered,Tsamai,,8621,"Census, ongoing research by Graziano Sava, Mauro Tosco ",5.4382,37.2463,
1604,Phalura,phalura,phalura,Pakistan,PAK,phl,Definitely endangered,"Palula, Palola, Phalulo, Dangarik, Biyori",,8600,"Decker, Kendall D. 1992. Languages of Chitral. Sociolinguistic Survey of Northern Pakistan, 5. Islamabad: National Institute of Pakistan Studies, Quaid-i-Azam University and Summer Institute of Linguistics. xxii, 257 p.
Available at http://www.sil.org/sociolx/pubs/32850_SSNP05.pdf.
",35.7264,71.7434,"Eight villages in Sourthern Chitral, near Drosh, NWFP, Pakistan"
1268,Northern Popoloc,popoloc septentrional,popoloca septentrional,Mexico,MEX,,Vulnerable,ngigua,,8597,Census 2000 and information provided by INALI,18.6818,-97.658,"Municipality of Tlacotepec de Benito Juárez, state of Puebla"
1274,Ixcatlán Mazatec,mazatèque d'Ixcatlán,mazateco de Ixcatlán,Mexico,MEX,mzi,Vulnerable,"en ningotsie, Mazateco de la presa bajo",,8593,Census 2000 and information provided by INALI,18.1447,-96.4855,"Municipality of San Pedro Ixcatlán, state of Oaxaca"
918,Patla-Chicontla Totonac,totonaque de Patla-Chicontla,totonacano de Patla,Mexico,MEX,tku,Severely endangered,"Totonaco del rio Necaxa, Upper Necaxa Totonac",,8590,Contributors: Carolyn MacKay and Frank Treschel; their sources are the 2005 Census and information by INALI,20.1644,-97.6927,"Patla, Chicontla, San Pedro Tlaolantongo in the municipality of Jopala, state of Puebla; Zihuatleutla, state of Puebla"
1647,Toram,toram,toram,Chad,TCD,trj,Severely endangered,,,8456,Ethnologue,11.1581,19.6023,
994,Northwestern Tlapanec,tlapanèque nord-occidental,tlapaneco noroccidental,Mexico,MEX,,Vulnerable,,,8409,Census 2000 and information provided by INALI,17.5595,-98.9332,"Municipality of Atlixtac, state of Guerrero"
271,Dene,dene,dené,Canada,CAN,chp,Vulnerable,Chipewyan,,8195,"1996 and 2001 Censuses, Statistics Canada; based on the Department of Canadian Heritage customized census retrievals
UNESCO Atlas 2nd edition (Wurm (2001))
Ethnologue: Languages of the World (Gordon, (2005))
http://www.aboriginalcanada.gc.ca/acp/community/site.nsf/index_en.html
http://en.wikipedia.org/wiki/Portal:Contents",56.4807,-109.4127,Spread over 28 communities in Canada
1526,Micmac (Massachusetts),micmac (Massachusetts),micmac (Massachussets),United States of America,USA,mic,Definitely endangered,"Mi´kmaq, Mi’gmaq, Miikmaq, Mi'gmaw",,8145,Golla et al ms.,42.3589,-71.0578,"The majority of U.S. speakers live in the Boston, Massachusetts area; Canadian communities are Restigouche, Quebec; Big Cove, New Brunswick; and Eskasoni,  Nova Scotia."
88,Argobba,argobba,argobba,Ethiopia,ETH,agj,Critically endangered,,,8000,"Andreas Wetter, Ethnologue",10.5958,39.9792,
708,Austral dialects,dialectes des Iles Australes,dialectos de las islas Australes,French Polynesia (France),PYF,aut,Definitely endangered,"Rurutu, Tupuai, Rimatara, Raivavae",,8000,"Wurm, Stephen 2007. 'Australia and the Pacific', pp. 425-578 in Christopher Moseley (ed.) Encyclopedia of the World's Endangered Languages. London/New York: Routledge.
Grimes 2000",-23.3775,-149.4909,"Austral Islands (Rurutu, Tupuai, Rimatara, Raivavae)"
1693,Belanda Bor,belanda bor,belanda bor,Sudan,SDN,bxb,Definitely endangered,De Bor,,8000,Ethnologue,6.4954,27.7404,
1701,Feroge,feroge,feroge,Sudan,SDN,fer,Vulnerable,Kaligi (dialect? Indri),,8000,Ethnologue,8.5049,25.7189,
1980,Hachijō,hachijō,hachijō,Japan,JPN,,Definitely endangered,,,8000,Akihiro Kaneda: The tense-aspect system and evidentiality in the Hachijo dialect. Lingua Posnaniensis 47 (2005): 75–86.,33.11,139.7891,the Hachijō and Aogashima Islands of the Izu Archipelago south of Tokyo; an outlying dialect of Japanese not listed at all by the SIL
1853,Inga,inga,inga,Colombia,COL,"inb, inj",Severely endangered,"Inga, Ingano",,8000,Arango & Sánchez. Los pueblos indígenas de Colombia en el umbral del nuevo milenio. 2004.,1.1658,-77.0011,"Sibundoy Valley in and around Santiago, San Andrés and Colón; Aponte (Department of Nariño)"
67,Kanga,kanga,canga,Sudan,SDN,kcp,Severely endangered,,,8000,Ethnologue,10.844,29.4708,
2424,Lajia,lajia,lakia,China,CHN,lbc,Definitely endangered,"Lakkia, Chashan Yao",,8000,Bradley 2007,23.7439,110.0526,
1255,Lakha,lakha,lakha,Bhutan,BTN,lkh,Definitely endangered,Tsangkha,,8000,"Driem, George van. 1991. Report on the First Linguistic Survey of Bhutan. Thimphu: Royal Government of Bhutan.

Driem, George van. 2001. Languages of the Himalayas. Volumes 1 and 2. Hand-book of Oriental Studies. Section Two: India. Leiden/Boston/Köln: Brill.

Driem, George van. 2007. 'South Asia and the Middle East', pp. 283-347 in Christopher Moseley (ed.) Encyclopedia of the World's Endangered Languages. London/New York: Routledge.

ethnologue.com",27.5898,90.3735,’Wangdi Phodr’a district
2187,Mbya Guarani (Paraguay),mbyá guarani (Paraguay),guaraní mbyá (Paraguay),Paraguay,PRY,gun,Definitely endangered,,,8000,,-26.5099,-55.2832,
1675,Mundurukú,mundurukú,mundurucú,Brazil,BRA,myu,Vulnerable,Mundurucu,,8000,"Moore, 2008.",-8.1027,-57.3486,
767,Ojibwe,ojibwe,oyibua,United States of America,USA,ciw,Severely endangered,"Anishinaabemowin, Ojibwa, Chippewa",,8000,"Golla et al. ms.
U.S. Census 2000 (http://www.mla.org/map_data_results&mode=lang_tops&SRVY_YEAR=2000&lang_id=819)",46.0706,-93.6677,"Spoken in the states of Minnesota, Wisconsin, and Michigan."
586,Quichua (Salasaca),quichua (Salasaca),quichua (Salasaca),Ecuador,ECU,"qxr, qug, qvi, qvj, qvo, qvz, qxl",Definitely endangered,"Kichwa, Runashimi, Runa simi, Salasaca Quichua, Quichua Salasaca Highland (Ethnologue)",,8000,"- Consejo Nacional de Planificación de los Indios y Negros del Ecuador, CONPLADEIN, Ayuda Memoria del Taller de Nacionalidades y Pueblos, julio 1998. 
- Ministerio del Ambiente, Sistema de Áreas Protegidas, SNAP, 2001. 
- CODENPE - SIDENPE - SIISE, 2002
- http://www.codenpe.gov.ec/salasaka.htm",-1.3511,-78.6511,"Province of Tungurahua (Central Highlands), San Pedro de Pelileo county, García Moreno and  Salasaca Parishes"
1182,Rongpo,rongpo,rangpo,India,IND,rnp,Vulnerable,,,8000,,30.7229,79.7387,"Uttarakhand, Chamoli dt. "
557,Sanyi,sanyi,sanie,China,CHN,ysy,Severely endangered,"Sa'nguie, Bai Yi",,8000,Bradley 2007,24.9262,102.5134,
2284,Temuan,temuan,temuano,Malaysia,MYS,tmw,Severely endangered,,,8000,Bradley 2007,3.3709,101.984,
1726,Tingal,tingal,tingal,Sudan,SDN,tie,Definitely endangered,Kajaja,,8000,Ethnolgue,12.238,31.1215,
735,Wampis,huambisa (wampis),huambisa,Peru,PER,hub,Vulnerable,"Huambisa, Wambisa",,8000,"Pozzi-Escot (2008), 'El multilingüismo en el Perú'",-3.4476,-77.7941,Departamentos de Amazonas  y Loreto; cuenca de  ríos Morona y Santiago.
2402,Wunai Bunu,bunu wunai,bunú wunai,China,CHN,bwn,Definitely endangered,Ngnai Bunu,,8000,Bradley 2007,24.4146,107.8378,
739,Yanesha,yanesha,amuesa,Peru,PER,ame,Severely endangered,Amuesha,,8000,"Pozzi-Escot (1998), 'El multilingüismo en el Perú'",-10.3743,-75.2343,"Depto. de  Cerro de Pasco, Prov. de  Oxapampa, cuenca de  río Palcazu.
Depto. de Junín, Prov. de Chanchamayo, alto Perené."
1369,Mam (Mexico),mam (Mexique),mam (México),Mexico,MEX,,Severely endangered,"qyool, banax in Soconusco",,7977,"Census 2000, information provided by INALI
Complementary information provided by contributor H. Antonio García Zúñiga",17.3661,-93.5334,"Locality of Chimalapa  and others in Municipality of  Mazapa de Madero, municipalities of Amatenango de la Frontera, Bejucal de Ocampo, Comalapa, Huehuetán, Mototzintla, and others in the state of Chiapas; municipalities of Campeche and Othón P. Blanco in the state of Campeche"
1318,Pana,pana,pana,Burkina Faso,BFA,png,Definitely endangered,,,7800,Ethnologue,13.165,-3.4277,
1983,Macushi (Guyana),macushi (Guyane),macusí (Guyana),Guyana,GUY,mbc,Vulnerable,"Makuxí, Makushi",,7750,"J. Forte, in Queixalós and Renault-Lescure (2000), 'As línguas amazônicas hoje'",3.6888,-59.4799,Rupununi savannahs in the southwestern part of Guyana. More in Roraima (Brazil).
466,Chukchi,tchouktche,chukoto,Russian Federation,RUS,ckt,Severely endangered,Luoravetlan,,7742,А. А. Бурыкин: Чукотский язык http://lingsib.unesco.ru/ru/languages/chukchi.shtml.htm,67.6248,176.1767,most parts of Chukchi Autonomous District and adjacent regions in Koryak Autonomous District and Lower Kolyma (Nizhnekolymskiy) County in the Republic of Sakha (Yakutia)
1875,Cabécar,cabecar,cabécar,Costa Rica,CRI,,Vulnerable,,,7622,Census 2000 and Constenla article,9.9012,-83.6844,Atlantic watershed and southern Pacific slopes of the Talamanca range in southern Costa Rica according to Constenla
593,Awa Cuaiquer,awa-cuaiquer,cuaiquer,Colombia,COL,kwi,Critically endangered,"Kwaiker, Awa Pit (language), Awa (people)",,7500,"Plan de Vida Awa - 
Arango and Sánchez, 'Los pueblos indígenas de Colombia' (2004)
Rodríguez en González, 'Lenguas indígenas de Colombia' (2000)
T. Curnow, 'A grammar of Awa Pit' (ms.)",1.4939,-78.5742,"Mainly in the department of Nariño, adjacent to Ecuador, between Pasto and the  Pacific ocean"
2172,Lishana Deni (Israel),lishana deni (Israël),lishana deni  (Israel),Israel,ISR,lsd,Severely endangered,"Lishan Hudaye, Lishan Hozaye, Judeo Aramaic, Jewish Northeastern Neo-Aramaic",,7500,"H. Mutzafi (p.c.)
Mutzafi, H. The Jewish Neo-Aramaic Dialect of Koy Sanjaq (Iraqi Kurdistan)
Semitica Viva 32, Wiesbaden: Harrassowitz, 2004.",31.7748,35.1013,Jerusalem and  vicinity and in the rest of the country.  Population immigrated  from northwest Iraqi Kurdistan in early 1950's.
925,Central Pame,pamé central,pame central,Mexico,MEX,pbs,Vulnerable,xi'oi,,7399,Census 2000,21.9208,-99.3741,"Santa Catarina, Tamasopo (state of San Luis Potosí)"
309,Puinave,puinave,puinave,"Colombia, Venezuela (Bolivarian Republic of)","COL, VEN",pui,Definitely endangered,Wansöjöt,,7377,"Arango and Sánchez, 'Los pueblos indígenas de Colombia' (2004)
González and Rodríguez, 'Lenguas indígenas de Colombia' (2000)
J.M. Girón, 'Una gramática del wansöjöt' (2008).",4.434,-68.1591,Colombia: On the Inirida river in the department of Guainía. Also in Guaviare and Vichada. Venezuela: In Atabapo (Amazonas).
1702,Mebengokre,mebengokre,cayapó,Brazil,BRA,txu,Vulnerable,"Kayapó, Xikrin, Put Karot, Mebengokre",,7266,"Databank Moore, 2008.",-6.5569,-52.4707,"Both the Kayapó and the Xikrin call themselves Mebengokre and speak dialects of the same language.  Older Xikrin don't consider themselves Kayapó.  The various village names (A'ukre, Gorotire, Kokrimoro, etc) are often confused with dialects or languages."
316,Tunebo,tunebo,tunebo,"Colombia, Venezuela (Bolivarian Republic of)","COL, VEN","tnd, tbn, tuf, tnb",Definitely endangered,"U'wa (people), Uw Kuwa (language)",,7231,"Arango and Sánchez, 'Los pueblos indígenas de Colombia' (2004)
González and Rodríguez, 'Lenguas indígenas de Colombia' (2000)
",6.4463,-72.0483,"Departments of Boyacá (eastern slopes of the Siera Nevada del Cocuy), Norte de Santander, Casanare and Arauca (Colombia)."
1015,Quechua of Peruvian Amazonia,quechua de l'Amazonie péruvienne,quechua amazónico peruano,Peru,PER,"qln, qlb",Vulnerable,"Quichua, Quichua amazónico",,7200,,-2.3723,-74.1137,"Preferentemente  en el Dpto. de  Loreto, pero también en algunas  zonas de  Madre de Dios."
1217,Asur,asuri,asuri,India,IND,asr,Definitely endangered,"Asuri, Assur",,7000,,22.4719,84.9023,
2301,Bashkardi,bashkardi,baskardí,Iran (Islamic Republic of),IRN,bsg,Definitely endangered,Bashaka,,7000,"Gordon, Raymond G., Jr. (ed.), 2005. Ethnologue: Languages of the World, Fifteenth edition. Dallas, Tex.: SIL International. Online version: http://www.ethnologue.com/.
",28.5169,57.7551,"Eastern Hormozgan, Southern Kerman, and possibly southwestern Sistan and Baluchistan provinces."
91,Burji,burji,buryí,Kenya,KEN,bji,Vulnerable,,,7000,Ethnologue,2.1857,37.9248,
2431,Choyi,choyi,queyu,China,CHN,qvy,Definitely endangered,Queyu,,7000,Bradley 2007,30.8519,99.6659,
2061,Gazi,gazi,gazi,Iran (Islamic Republic of),IRN,gzi,Definitely endangered,,,7000,"Gordon, Raymond G., Jr. (ed.), 2005. Ethnologue: Languages of the World, Fifteenth edition. Dallas, Tex.: SIL International. Online version: http://www.ethnologue.com/.",32.8036,51.6211,"Gaz region, Iran"
2433,Guichong,guiqiong,guichión,China,CHN,gqi,Vulnerable,,,7000,Bradley 2007,30.8148,101.7021,
1332,Karagash,karagash,tofa,Russian Federation,RUS,,Definitely endangered,,,7000,Л. Ш. Арсланов: Язык карагашей-ногайцев Астраханской области. Набережные Челны 1992.,47.2643,47.2412,Krasnoyarskiy and Kharabali counties in Astrakhan Province; an outlying dialect of Nogay not listed at all by the SIL
1786,Natanzi,natanzi,natanzí,Iran (Islamic Republic of),IRN,ntz,Severely endangered,,,7000,,33.452,51.3006,"Natanz, Isfahan Province, Iran"
1783,Nayini,nayini,nayiní,Iran (Islamic Republic of),IRN,nyq,Severely endangered,Biyabanak,,7000,,32.8519,53.1573,"Nayin and Anarak, Esfahan Province, Iran"
1439,Parya,parya,parya,"Uzbekistan, Tajikistan, Afghanistan","UZB, TJK, AFG",paq,Severely endangered,"""Парйа"", ""Afghana-Yi Nasfurush"","" Afghana-Yi Siyarui"",""Laghmani""",,7000,"Studies in Languages of Tajikistan' edited by John M.Clifton, 2005",38.5094,68.0932,"Hissor Valley of western Tajikistan, Surkhandarya Valley of Uzbekistan and Kunduz region of Afghanistan"
103,Segeju,segeju,daiso,United Republic of Tanzania,TZA,seg,Severely endangered,,,7000,Ethnologue,-4.8173,39.0783,
1795,Sivandi,sivandi,sivandi,Iran (Islamic Republic of),IRN,"siy, faz",Definitely endangered,,,7000,,29.9168,51.5945,"Sivand, Fars Province , Iran"
2302,Soi,soi,soi,Iran (Islamic Republic of),IRN,soi,Definitely endangered,,,7000,"Gordon, Raymond G., Jr. (ed.), 2005. Ethnologue: Languages of the World, Fifteenth edition. Dallas, Tex.: SIL International. Online version: http://www.ethnologue.com/.",31.6533,55.6787,Central Iran
1852,Tucano (Brazil),tucano (Brésil),tucano (Brasil),Brazil,BRA,tuo,Vulnerable,"Tukáno, Tucano, Ye'pã-masa, Dasea",,7000,"Databank Moore, 2008.",0.1757,-67.2363,"Tukano is spoken by various people who are not ethnically Tukano, increasing the speaker numbers"
320,Wapishana (Guyana),wapishana (Guyane),wapishana (Guyana),Guyana,GUY,wap,Vulnerable,Wapixána,,7000,"J. Forte, in: Queixalós and Renault-Lescure, 'As línguas amazônicas hoje' (2000).",2.3065,-59.6997,"Southwestern part of Guyana (area of Lethem, western tributaries of the Essequibo). State of Roraima, Brazil."
1739,Yulu,yulu,yulu,"Central African Republic, Democratic Republic of the Congo, Sudan","CAF, ZAI, SDN",yul,Vulnerable,,,7000,Ethnologue,8.3854,24.1754,
2438,Zhaba,zhaba,chaba,China,CHN,zhb,Vulnerable,Zaba,,7000,Bradley 2007,31.4,100.4734,
1828,Sakapultek,sakapultèque,sacapulteco,Guatemala,GTM,quv,Definitely endangered,,,6973, XI Censo Nacional de Población for number of speakers and names of languages;  contributor H. Antonio García Zúñiga consulted Ethnologue for several locations,14.9752,-91.0527,Sacapulas
1677,Chara,chara,chara,Ethiopia,ETH,cra,Vulnerable,,,6932,"Census, Yvonne Treis",6.479,36.3647,
2339,Kosraean,kosrae,kosreano,"Micronesia (Federated States of), Nauru","FSM, NRU",kos,Severely endangered,Kusaie,,6900,Grimes 2000,5.322,162.9904,Also spoken on Nauru
1902,Waunana (Panama),waunana (Panama),waumeo (Panamá),Panama,PAN,noa,Severely endangered,"Waunmeo, Waunana, Waumeu, Nonama, Chocame, Chanco",,6882,"Census 2000, Ethnologue",8.2984,-78.1018,Southern Panama Lowlands
694,San Francisco del Mar Huave,huave de San Francisco del Mar,huave de San Francisco del Mar,Mexico,MEX,hue,Critically endangered,,,6874,"Contributor: Samuel Herrera, Census 2005",16.3333,-94.5166,"Municipality of San Francisco del Mar, state of Oaxaca"
692,Northern East Cree,cree du nord-est,clisteno nororiental,Canada,CAN,crl,Vulnerable,,,6870,"1996 and 2001 Censuses, Statistics Canada; based on the Department of Canadian Heritage customized census retrievals
UNESCO Atlas 2nd edition (Wurm (2001))
Ethnologue: Languages of the World (Gordon, (2005))
http://www.aboriginalcanada.gc.ca/acp/community/site.nsf/index_en.html
http://en.wikipedia.org/wiki/Portal:Contents",53.6916,-78.8011,Spread over 5 communities in Canada
1317,Micmac (Canada),micmac (Canada),micmac (Canadá),Canada,CAN,mic,Vulnerable,,,6850,"1996 and 2001 Censuses, Statistics Canada; based on the Department of Canadian Heritage customized census retrievals
UNESCO Atlas 2nd edition (Wurm (2001))
Ethnologue: Languages of the World (Gordon, (2005))
http://www.aboriginalcanada.gc.ca/acp/community/site.nsf/index_en.html
http://en.wikipedia.org/wiki/Portal:Contents",45.9646,-60.6172,Spread over 32 communities in Canada
2720,Northern Tepehuán,tepehuan septentrional,tepehuano septentrional,Mexico,MEX,tnp,Definitely endangered,,,6802,Contributor: Zarina Estrada and information provided by INALI,26.4258,-107.2683,Baborigame in the state of Chihuahua
1087,Miju,miju,miju,"China, India","CHN, IND",mxj,Vulnerable,"Keman, Miju Mishmi, Geman Deng",,6700,,28.1155,96.2896,"Arunachal Pradesh, Lohit and Anjan districts"
879,Rio Grande Keresan,keresan du Rio Grande,queresano de Río Grande,United States of America,USA,,Definitely endangered,Keres,,6685,"Victor Golla, Ives Goddard, Lyle Campbell, Marianne Mithun, and Mauricio Mixco. 2007. North America. Atlas of the World’s Languages (2nd. edition), ed. by R.E. Asher and C.J. Moseley, 7-44.  London: Routledge.

",35.5147,-106.3655,"Spoken in five pueblos north of Albuquerque, NM:  Zia, Santa Ana, San Felipe, Santo Domingo, and Cochiti."
1281,Western Mazatec,mazatèque occidental,mazateco del oeste,Mexico,MEX,,Vulnerable,"enna,",,6639,Census 2000 and information provided by INALI,18.1351,-96.9057,Municipalities of San Lucas Zoquiapan and San Martín Toxpalan
1676,Bussa,bussa,busa,Ethiopia,ETH,dox,Vulnerable,,,6624,"Census, Ethnologue, Mauro Tosco (ongoing research)",5.7225,37.1406,
1694,Beli,beli,beli,Sudan,SDN,blm,Definitely endangered,,,6600,Ethnologue,6.4736,29.2675,
2444,Chesu,chesu,chesu,China,CHN,ych,Definitely endangered,,,6600,Bradley 2007,24.4211,102.0459,
57,Thuri,thuri,thuri,Sudan,SDN,thu,Vulnerable,,,6600,Abdel Rahim Mugaddam & Gerrit Dimmendaal 2005,8.4397,25.4333,"Southern Sudan between Wau and Aweil, between Jur and Lol rivers, on Raga-Nyamlell road, and on Wau-Deim Zubeir road."
1053,Karata,karata,karata,Russian Federation,RUS,kpt,Definitely endangered,Tokita (dialect),,6574,"М. Е. Алексеев: Каратинский язык. — Языки Российской Федерации и соседних государств: энциклопедия II. Москва: Наука, 2001.",42.5874,46.3348,"nine villages, including Karata and Tokita (Tukita), in Akhvakh County in the Republic of Daghestan"
2375,Saulteau,saulteau,saulteaux,Canada,CAN,ojw,Vulnerable,Western Ojibway,,6558,"1996 and 2001 Censuses, Statistics Canada; based on the Department of Canadian Heritage customized census retrievals
UNESCO Atlas 2nd edition (Wurm (2001))
Ethnologue: Languages of the World (Gordon, (2005))
http://www.aboriginalcanada.gc.ca/acp/community/site.nsf/index_en.html
http://en.wikipedia.org/wiki/Portal:Contents",50.5573,-98.6562,Spread over 70 communities in Canada
1166,Kumāle,kumāle,kumhali,Nepal,NPL,kra,Severely endangered,कुमाले; Kumhali; Kumhale; Kumbale; Kumkale; Kumali,,6533,"Driem, George van. 2001. Languages of the Himalayas. Volumes 1 and 2. Hand-book of Oriental Studies. Section Two: India. Leiden/Boston/Köln: Brill.

Driem, George van. 2007. 'South Asia and the Middle East', pp. 283-347 in Christopher Moseley (ed.) Encyclopedia of the World's Endangered Languages. London/New York: Routledge.

ethnologue.com",27.788,84.548,Gorkhā district
929,Lower Northwestern Otomí,bas otomí du nord-est,otomí noroccidental bajo,Mexico,MEX,,Vulnerable,Otomí de Santiago Mexquititlán,,6509,"Census 2000, research by Hekking",20.1865,-100.1469,"Santiago Mexquititlán Municipality of Amealco, Querétaro"
83,Dimme,dime,dimé,Ethiopia,ETH,dim,Vulnerable,,,6501,"Census, Mulugeta Seyoum, Ralf Siebert, Aklilu Yilma",5.9548,36.2988,
585,Chiquitano (Bolivia),chiquitano (État plurinational de Bolivie),Chiquitano (Bolivia),Bolivia (Plurinational State of),BOL,cax,Definitely endangered,"Besïro, Chiquito",,6500,"Censo Indígena Rural de las Tierras Bajas 1994.
H. de Haan, pers. comm.",-16.5835,-61.6113,"In the department of Santa Cruz, Bolivia: provinces of Ñuflo de Chávez, Velasco, Chiquitos, A. Sandoval, Germán Busch.
In the state of Mato Grosso, Brazil. The most active speakers are in the Lomerío area, near the mission town of Concepción."
1729,Tumtum,tumtum,tumtum,Sudan,SDN,tbr,Severely endangered,,,6500,Abdel Rahim Mugaddam & Gerrit Dimmendaal 2005,10.477,30.4321,
1042,Bezhta,bezhta,bejila,Russian Federation,RUS,kap,Definitely endangered,Kapucha,,6461,"М. Ш. Халилов: Бежтинский язык. — Языки Российской Федерации и соседних государств: энциклопедия I. Москва: Наука, 1997.",42.1369,46.1508,"the villages of Bezhta, Tlyadal, and Khasharkhota in Tsunta County in the Republic of Daghestan"
1115,Thakali,thakali,thakali,Nepal,NPL,ths,Vulnerable,थकाली; Tapang; Thaksya,,6441,"Driem, George van. 2001. Languages of the Himalayas. Volumes 1 and 2. Hand-book of Oriental Studies. Section Two: India. Leiden/Boston/Köln: Brill.

Driem, George van. 2007. 'South Asia and the Middle East', pp. 283-347 in Christopher Moseley (ed.) Encyclopedia of the World's Endangered Languages. London/New York: Routledge.

ethnologue.com",28.7146,83.6478,Kālī Gaṇḍakī river valley
